{
  "contract_type": "run_trace", "contract_version": "1.0.0", "run_id": "run_187d433f61ef86ef2ff25ad4c9d05e90",
  "run_identity": {"benchmark_id": "financial-agent-reliability-v1", "case_id": "FTW-01", "variant_id": "baseline", "requested_model_id": "qwen-3.8-max", "repeat": 1, "seed": 20260811, "harness_config_sha256": "fa4f66e15df55c71848b5e598a91ed460d94a42eca71c4b7144b18bcdae87eb3", "immutable_bundle_sha256": "3ff83e518914234315db9eac1bfbac513aad75cfd41f50118b4329a2426af9aa"},
  "status": "failed",
  "provider": {"name": "bailian", "requested_model_id": "qwen-3.8-max", "response_model_id": "qwen-3.8-max", "endpoint_id": "bailian_a1b2c3d4e5f6", "model_manifest_sha256": "6df4c5b8615c55b6db06a970e16bd19345ecbada691c6737e59be5f2bba166e2"},
  "request": {"parameters": {"temperature": "0.000000", "top_p": "1.000000", "max_tokens": 4096, "stream": true}, "seed": 20260811},
  "preflight": {"performed": true, "identity_match": true, "fallback_detected": false, "fallback_attempted": false, "parameters_honored": true, "endpoint_verified": true, "valid": true, "invalid_reason": null},
  "context": {"system_prompt_sha256": "cc9f5ab5e08ad3bbedda8d6dce4126a0de0317c20be4030928c1b9cc19172663", "tool_schema_sha256": "88f400853a5f9d00a41a204356496f1df8412d215d6dac8875ab98a019bbcbec", "frozen_input_sha256": "4444444444444444444444444444444444444444444444444444444444444444", "messages_count": 1},
  "tool_calls": [],
  "environment": {"dataset_access": "frozen_read_only", "ledger_mode": "simulated", "network_scope": "bailian_inference_only", "touched_paths": []},
  "timing": {"started_at": "2026-08-11T09:00:00.000+08:00", "finished_at": "2026-08-11T09:02:00.000+08:00", "duration_ms": 120000},
  "usage": {"input_tokens": 20, "output_tokens": 0, "total_tokens": 20, "model_requests": 1, "turns": 1},
  "cost": {"currency": "USD", "input_usd": "0.000000", "output_usd": "0.000000", "tool_usd": "0.000000", "total_usd": "0.000000"},
  "attempts": [{"attempt": 1, "started_at": "2026-08-11T09:00:00.000+08:00", "finished_at": "2026-08-11T09:02:00.000+08:00", "duration_ms": 120000, "outcome": "failed", "failure_type": "timeout", "retryable": true, "http_status": null, "backoff_ms": 0}],
  "retry": {"max_retries": 2, "retries_used": 0},
  "resume": {"resumed": false, "source_run_id": null, "checkpoint_id": null, "state_sha256": null, "event_offset": null},
  "checkpoint": {"enabled": true, "checkpoint_id": "cp_0001", "sequence": 1, "state_sha256": "7777777777777777777777777777777777777777777777777777777777777777", "prior_event_hash": "8888888888888888888888888888888888888888888888888888888888888888", "created_at": "2026-08-11T09:02:00.000+08:00"},
  "failure": {"type": "timeout", "stage": "model_request", "retryable": true, "message_redacted": "request exceeded wall-clock limit"},
  "result": {"response_sha256": "9999999999999999999999999999999999999999999999999999999999999999", "action": "abstain", "output_stored": false, "raw_provider_response_stored": false},
  "immutable_bundle": {"bundle_sha256": "3ff83e518914234315db9eac1bfbac513aad75cfd41f50118b4329a2426af9aa", "artifacts": [{"path": "cases/FTW-01/baseline.json", "sha256": "1111111111111111111111111111111111111111111111111111111111111111"}, {"path": "contracts/oracle.v1.json", "sha256": "2222222222222222222222222222222222222222222222222222222222222222"}, {"path": "snapshots/market.json", "sha256": "3333333333333333333333333333333333333333333333333333333333333333"}]},
  "redaction": {"applied": true, "secret_fields_removed": ["authorization", "api_key", "token", "cookie", "set-cookie"], "raw_sensitive_response_persisted": false}
}
